{"schema":"nightshift.operational-reobservation-evaluation/v1","evaluation_id":"sha256:f1acd9e7555d4679ed3fedec3f5f16001d34c6807217223ef8e7ac8f9fdf9ee6","lineage_id":"sha256:a48226f6b0e8d7fa405a3cffff196b3c1aaeea404dbbe33e3f4048dec09fe76f","profile_id":"profile:silicon-currentness:nominal","profile_digest":"sha256:be03f17d9f1bdf1bb048f68fc6bb05bf5e30d08e9e93886e618ff16a1c6840a3","max_age_seconds":3600,"evaluated_at":"2026-08-30T16:03:00Z","current_until":"2026-08-30T17:00:00Z","exact_supported_claim_ids":["ecad:artifact-observed-at","ecad:design-revision","ecad:input-artifact","ecad:license","ecad:license-identity","ecad:output-artifact","ecad:output-digest-match","ecad:output-present","ecad:pdk-identity","ecad:pdk-match","ecad:process-exit-code","ecad:repository-revision","ecad:repository-revision-match","ecad:scheduler-job","ecad:scheduler-observation","ecad:stage-name","ecad:stage-occurrence","ecad:toolchain-identity","ecad:toolchain-match","ecad:worker-identity","ecad:worker-observation"],"disposition":"current","reobservation_trigger":"none","next_lawful_action":"await_currentness_change","grants_authority":false}