{"schema":"nightshift.operational-reobservation-evaluation/v1","evaluation_id":"sha256:5ad2d38489e81649660efcf434515f50bc209a6672e76e8fc1f469f7456f71ae","lineage_id":"sha256:2a02563c94d0d1c5828bf10932463303e94b52bb48f222e34b4dcb3f7ce3ac30","profile_id":"profile:silicon-currentness:digest-mismatch","profile_digest":"sha256:26d6866562cdb2382cf5af9c1f43edc9f65ae759c6e18c273158353dfde09c54","max_age_seconds":3600,"evaluated_at":"2026-08-30T16:50:00Z","current_until":"2026-08-30T17:00:00Z","exact_supported_claim_ids":["ecad:artifact-observed-at","ecad:design-revision","ecad:design-revision-match","ecad:input-artifact","ecad:license","ecad:license-identity","ecad:observed-design-revision","ecad:observed-output-artifact","ecad:observed-pdk-identity","ecad:observed-repository-revision","ecad:observed-toolchain-identity","ecad:output-artifact","ecad:output-digest-match","ecad:output-present","ecad:pdk-identity","ecad:pdk-match","ecad:process-exit-code","ecad:repository-revision","ecad:repository-revision-match","ecad:scheduler-job","ecad:scheduler-observation","ecad:stage-name","ecad:stage-occurrence","ecad:toolchain-identity","ecad:toolchain-match","ecad:worker-identity","ecad:worker-observation"],"disposition":"current","reobservation_trigger":"none","next_lawful_action":"await_currentness_change","grants_authority":false}