{"schema":"nightshift.operational-reobservation-evaluation/v1","evaluation_id":"sha256:e84dee9183433e6fd1e198acb096d3dd6663a0efe94ed464faafa63f5d94bfaa","lineage_id":"sha256:575852d69077b1597fb0925b1b1d85326c88c926d1df83a9e36aae9348c33867","profile_id":"profile:silicon-currentness:stale-artifact","profile_digest":"sha256:c86fbbd7cd320c7e1e92739ad9b37f555e691b80bc3e337c0af7a9ab51de3979","max_age_seconds":3600,"evaluated_at":"2026-08-30T16:03:00Z","current_until":"2026-08-29T17:00:00Z","exact_supported_claim_ids":["ecad:artifact-observed-at","ecad:design-revision","ecad:input-artifact","ecad:license","ecad:license-identity","ecad:output-artifact","ecad:output-digest-match","ecad:output-present","ecad:pdk-identity","ecad:pdk-match","ecad:process-exit-code","ecad:repository-revision","ecad:repository-revision-match","ecad:scheduler-job","ecad:scheduler-observation","ecad:stage-name","ecad:stage-occurrence","ecad:toolchain-identity","ecad:toolchain-match","ecad:worker-identity","ecad:worker-observation"],"disposition":"stale","reobservation_trigger":"max_age_elapsed","next_lawful_action":"request_reobservation","grants_authority":false}