{"schema":"nightshift.operational-reobservation-evaluation/v1","evaluation_id":"sha256:9cbcf97cf95abf0cb7b07a7581ecef09669e3181fb52fa734f84479f4c4ba89a","lineage_id":"sha256:744019d66fdb74c507d59375c03769f4e4354bebfdb8482e1c8eab2b2160c8d6","profile_id":"profile:silicon-currentness:scheduler-contradiction-a","profile_digest":"sha256:ac611ea4eb378f6686494f92c3a16112ad63dc0a55c3110246a047e04c84d3a4","max_age_seconds":3600,"evaluated_at":"2026-08-30T16:50:00Z","current_until":null,"exact_supported_claim_ids":["ecad:artifact-observed-at","ecad:design-revision","ecad:design-revision-match","ecad:input-artifact","ecad:license","ecad:license-identity","ecad:observed-design-revision","ecad:observed-output-artifact","ecad:observed-pdk-identity","ecad:observed-repository-revision","ecad:observed-toolchain-identity","ecad:output-artifact","ecad:output-digest-match","ecad:output-present","ecad:pdk-identity","ecad:pdk-match","ecad:process-exit-code","ecad:repository-revision","ecad:repository-revision-match","ecad:scheduler-job","ecad:scheduler-observation","ecad:stage-name","ecad:stage-occurrence","ecad:toolchain-identity","ecad:toolchain-match","ecad:worker-identity","ecad:worker-observation"],"disposition":"contradictory","reobservation_trigger":"claim_contradiction","next_lawful_action":"request_qualification_review","grants_authority":false}