{"schema":"nightshift.operational-reobservation-evaluation/v1","evaluation_id":"sha256:d4d703eab9c8a5775b489f00a2942666002062a37b41c018a681e91256038da9","lineage_id":"sha256:c53a6c9809b121b4c72fb39409dd452cadf922bb47662e00e2c9ba6414ace55c","profile_id":"profile:silicon-currentness:repository-custody-historical","profile_digest":"sha256:7be74d3fe811098c293d6e2c35f5195bf378ea30129af9fec5812b4fa6fc1a8d","max_age_seconds":3600,"evaluated_at":"2026-08-30T16:50:00Z","current_until":"2026-08-29T17:00:00Z","exact_supported_claim_ids":["ecad:artifact-observed-at","ecad:design-revision","ecad:design-revision-match","ecad:input-artifact","ecad:license","ecad:license-identity","ecad:observed-design-revision","ecad:observed-output-artifact","ecad:observed-pdk-identity","ecad:observed-repository-revision","ecad:observed-toolchain-identity","ecad:output-artifact","ecad:output-digest-match","ecad:output-present","ecad:pdk-identity","ecad:pdk-match","ecad:process-exit-code","ecad:repository-revision","ecad:repository-revision-match","ecad:scheduler-job","ecad:scheduler-observation","ecad:stage-name","ecad:stage-occurrence","ecad:toolchain-identity","ecad:toolchain-match","ecad:worker-identity","ecad:worker-observation"],"disposition":"stale","reobservation_trigger":"max_age_elapsed","next_lawful_action":"request_reobservation","grants_authority":false}