{"schema":"nightshift.operational-reobservation-evaluation/v1","evaluation_id":"sha256:3dd33de6830ea926a718871328e6a523b55d6abe448d1569e182c1fdc9506157","lineage_id":"sha256:ab35168a2d31fe3c84cf0770100585182c6bfa981b3ecfd77f1dd6869d760385","profile_id":"profile:silicon-currentness:license-no-response","profile_digest":"sha256:3e2b7c0ce2ad8907fed06cdbe8a8a2ec5017377ae51dc59b02fbd777d6aa8903","max_age_seconds":3600,"evaluated_at":"2026-08-30T16:50:00Z","current_until":null,"exact_supported_claim_ids":[],"disposition":"acquisition_failure","reobservation_trigger":"acquisition_failure","next_lawful_action":"request_reobservation","grants_authority":false}